002:015:003:DESCRIPTOR         1620582280.541887
 05 0C 09 01 A1 01 95 01 75 10 15 01 26 FF 02 19
 01 2A FF 02 81 00 C0

002:015:002:DESCRIPTOR         1620582280.542756
 05 01 09 06 A1 01 05 07 19 E0 29 E7 15 00 25 01
 75 01 95 08 81 02 95 01 75 08 81 01 95 06 75 08
 15 00 26 FB 00 05 07 19 00 2A FB 00 81 00 C0

002:015:001:DESCRIPTOR         1620582280.543491
 06 13 FF 09 01 A1 01 15 00 26 FF 00 75 08 95 40
 09 02 81 02 09 03 91 02 C0

002:015:000:DESCRIPTOR         1620582280.544383
 05 01 09 02 A1 01 09 01 A1 00 05 09 19 01 29 05
 15 00 25 01 75 01 95 05 81 02 75 01 95 03 81 01
 75 10 95 02 05 01 09 30 09 31 16 01 80 26 FF 7F
 81 06 09 38 15 81 25 7F 95 01 75 08 81 06 C0 C0

