003:006:002:DESCRIPTOR         1609006487.558325
 06 00 FF 09 01 A1 01 09 02 15 00 26 FF 00 75 08
 95 40 81 02 09 03 15 00 26 FF 00 75 08 95 40 91
 02 0A 00 FF 75 08 95 40 B1 02 C0

003:006:001:DESCRIPTOR         1609006487.558859
 05 01 09 06 A1 01 85 01 05 07 19 E0 29 E7 15 00
 25 01 75 01 95 08 81 02 95 01 75 08 81 01 05 07
 15 00 26 E7 00 19 00 2A E7 00 75 08 95 06 81 00
 C0 05 0C 09 01 A1 01 85 02 15 00 26 3C 02 19 00
 2A 3C 02 75 10 95 01 81 00 C0

003:006:000:DESCRIPTOR         1609006487.559345
 05 01 09 02 A1 01 09 01 A1 00 05 09 19 01 29 05
 15 00 25 01 95 05 75 01 81 02 95 03 81 01 05 01
 16 01 80 26 FF 7F 09 30 09 31 75 10 95 02 81 06
 15 81 25 7F 09 38 75 08 95 01 81 06 C0 C0
